{
  "id": "happy_path_no_bitlocker",
  "description": "Supported system installs and verifies both operating systems.",
  "steps": [
    "begin_preflight",
    "acquire_release_manifest",
    "persist_release_acceptance",
    "accept_preflight_and_plan",
    "begin_payload_staging",
    "accept_verified_payload",
    "show_exact_plan",
    "confirm_exact_plan",
    "prepare_without_bitlocker",
    "reserve_windows_space",
    "create_xbootldr",
    "format_xbootldr",
    "copy_verified_payload",
    "stage_installer_loader",
    "create_installer_entry",
    "arm_installer_bootnext",
    "reboot_to_installer",
    "installer_boot_observed",
    "verify_linux_handoff",
    "revalidate_linux_plan",
    "create_linux_root",
    "format_linux_root",
    "deploy_jstack_image",
    "configure_jstack_system",
    "install_jstack_boot",
    "verify_offline_install",
    "arm_windows_finalizer",
    "arm_windows_finalize",
    "windows_finalizer_booted",
    "restore_windows_security",
    "cleanup_windows_bootstrap",
    "arm_installed_jstack",
    "reboot_to_installed_jstack",
    "jstack_boot_observed",
    "complete_after_first_boot"
  ],
  "expected_terminal": "terminal.completed"
}
