{
  "id": "bootnext_rearm_exhausted",
  "description": "A second unexpected Windows resume exhausts the single BootNext rearm and automatically rolls back.",
  "steps": [
    "begin_preflight",
    "accept_preflight_and_plan",
    "begin_payload_staging",
    "accept_verified_payload",
    "show_exact_plan",
    "confirm_exact_plan",
    "prepare_without_bitlocker",
    "reserve_windows_space",
    "create_xbootldr",
    "format_xbootldr",
    "copy_verified_payload",
    "stage_installer_loader",
    "create_installer_entry",
    "arm_installer_bootnext",
    "reboot_to_installer",
    "windows_resumed_instead",
    "arm_installer_reboot_retry",
    "rearm_installer_boot",
    "windows_resumed_instead",
    "exhaust_installer_rearm",
    "dispatch_rollback_windows",
    "execute_windows_rollback",
    "rollback_remove_esp_files",
    "rollback_delete_partitions",
    "rollback_expand_windows",
    "rollback_restore_security",
    "rollback_unregister_finalizer"
  ],
  "expected_terminal": "terminal.rolled_back"
}
