{
  "id": "deploy_power_loss_reconcile",
  "description": "Power loss after deployment postcondition advances safely, then rollback remains available.",
  "steps": [
    "begin_preflight",
    "accept_preflight_and_plan",
    "begin_payload_staging",
    "accept_verified_payload",
    "show_exact_plan",
    "confirm_exact_plan",
    "prepare_without_bitlocker",
    "reserve_windows_space",
    "create_xbootldr",
    "format_xbootldr",
    "copy_verified_payload",
    "stage_installer_loader",
    "create_installer_entry",
    "arm_installer_bootnext",
    "reboot_to_installer",
    "installer_boot_observed",
    "verify_linux_handoff",
    "revalidate_linux_plan",
    "create_linux_root",
    "format_linux_root",
    {
      "transition": "deploy_jstack_image",
      "outcome": "interrupted_postcondition"
    },
    "request_rollback_from_linux_image_deployed",
    "dispatch_rollback_linux",
    "reboot_to_windows_rollback",
    "execute_windows_rollback",
    "rollback_remove_esp_files",
    "rollback_delete_partitions",
    "rollback_expand_windows",
    "rollback_restore_security",
    "rollback_unregister_finalizer"
  ],
  "expected_terminal": "terminal.rolled_back"
}
