{
  "id": "cancel_before_mutation",
  "description": "User cancellation before confirmation is a no-op.",
  "steps": [
    "begin_preflight",
    "accept_preflight_and_plan",
    "begin_payload_staging",
    "accept_verified_payload",
    "show_exact_plan",
    "cancel_before_mutation"
  ],
  "expected_terminal": "terminal.cancelled"
}
